{
  "$schema": "https://json-schema.org/draft/2020-12/schema",
  "$id": "./llm-config.schema.json",
  "title": "Agentic Wiki LLM Config",
  "description": "Configuration for multi-model LLM routing. Each task can use a different provider and model. Route entries support the JSON-serializable subset of Vercel AI SDK CallSettings plus providerOptions and app-level timeoutMs.",
  "type": "object",
  "additionalProperties": false,
  "required": ["version", "defaults", "providers"],
  "properties": {
    "$schema": {
      "type": "string"
    },
    "version": {
      "const": 1,
      "description": "Config schema version. Must be 1."
    },
    "defaults": {
      "$ref": "#/$defs/defaultRoute",
      "description": "Default route applied to all tasks unless overridden."
    },
    "tasks": {
      "type": "object",
      "description": "Per-task route overrides. Unspecified fields inherit from defaults. Keys are either built-in tasks (query/lint/merge/split/curate/fix/embedding) or '<pipeline>:<stage>' routes that override the model for a single agent-pipeline stage. Known ingest stages: ingest:planner, ingest:chunk-summarizer, ingest:writer, ingest:enricher, ingest:verifier, ingest:verifier-triage, ingest:verifier-apply, ingest:indexer. A stage entry is optional — without it the stage inherits the 'defaults' route (skill frontmatter may further override). Note: there is no standalone 'ingest' task; the pipeline routes per stage via 'ingest:<stage>'.",
      "propertyNames": {
        "pattern": "^(query|lint|merge|split|curate|fix|embedding|[a-z0-9][a-z0-9-]*:[a-z0-9][a-z0-9-]*)$"
      },
      "additionalProperties": {
        "$ref": "#/$defs/taskRoute"
      },
      "properties": {
        "query": { "$ref": "#/$defs/taskRoute", "description": "Ask AI: agentic tool-loop Q&A over the wiki with citations." },
        "lint": { "$ref": "#/$defs/taskRoute", "description": "Health check: scan the wiki for findings (broken links, missing cross-refs, contradictions)." },
        "merge": { "$ref": "#/$defs/taskRoute", "description": "Fuse two pages into one (invoked by page curation, not a standalone job)." },
        "split": { "$ref": "#/$defs/taskRoute", "description": "Split one page into several (invoked by page curation, not a standalone job)." },
        "curate": { "$ref": "#/$defs/taskRoute", "description": "Agent-driven page curation: triage then confirm merge/split candidates." },
        "fix": { "$ref": "#/$defs/taskRoute", "description": "Health fix: repair lint findings page by page." },
        "embedding": { "$ref": "#/$defs/taskRoute", "description": "Vector embeddings for semantic search. Only openai / openai-compatible / ollama providers are supported." }
      }
    },
    "providers": {
      "type": "object",
      "description": "Named provider profiles. Referenced by 'profile' in defaults/tasks.",
      "minProperties": 1,
      "additionalProperties": {
        "$ref": "#/$defs/providerProfile"
      }
    }
  },
  "$defs": {
    "jsonValue": {
      "description": "Any JSON-serializable value.",
      "oneOf": [
        { "type": "string" },
        { "type": "number" },
        { "type": "boolean" },
        { "type": "null" },
        {
          "type": "array",
          "items": { "$ref": "#/$defs/jsonValue" }
        },
        {
          "type": "object",
          "additionalProperties": { "$ref": "#/$defs/jsonValue" }
        }
      ]
    },
    "headers": {
      "type": "object",
      "additionalProperties": { "type": "string" },
      "description": "Additional HTTP headers sent with each LLM request. Only applicable for HTTP-based providers."
    },
    "taskRoute": {
      "type": "object",
      "description": "Route override for a specific task. All fields are optional and inherit from defaults. This intentionally contains route-level JSON settings only; runtime-only AI SDK parameters such as prompts, schemas, tools, callbacks, and AbortSignal belong in code.",
      "additionalProperties": false,
      "properties": {
        "profile": {
          "type": "string",
          "minLength": 1,
          "description": "Name of a provider profile from the 'providers' section."
        },
        "model": {
          "type": "string",
          "minLength": 1,
          "description": "Model ID to use (e.g., 'claude-3-5-sonnet-20241022', 'gpt-4o')."
        },
        "maxTokens": {
          "type": "integer",
          "minimum": 1,
          "description": "AI SDK CallSettings.maxTokens: maximum number of output tokens to generate."
        },
        "temperature": {
          "type": "number",
          "minimum": 0,
          "maximum": 2,
          "description": "AI SDK CallSettings.temperature: sampling temperature. Recommended: set either temperature or topP, not both. Provider/model ranges may differ."
        },
        "topP": {
          "type": "number",
          "minimum": 0,
          "maximum": 1,
          "description": "AI SDK CallSettings.topP: nucleus sampling; only tokens comprising the top P probability mass are considered. Recommended: set either temperature or topP, not both."
        },
        "topK": {
          "type": "integer",
          "minimum": 1,
          "description": "AI SDK CallSettings.topK: only sample from the top K most likely tokens. Provider support varies."
        },
        "presencePenalty": {
          "type": "number",
          "minimum": -1,
          "maximum": 1,
          "description": "AI SDK CallSettings.presencePenalty: affects likelihood of repeating information already in the prompt. Provider support/ranges vary."
        },
        "frequencyPenalty": {
          "type": "number",
          "minimum": -1,
          "maximum": 1,
          "description": "AI SDK CallSettings.frequencyPenalty: affects likelihood of repeatedly using the same words or phrases. Provider support/ranges vary."
        },
        "stopSequences": {
          "type": "array",
          "items": { "type": "string" },
          "description": "AI SDK CallSettings.stopSequences: generation stops when the model outputs one of these strings. Used by streamText; generateObject omits stopSequences in AI SDK v4."
        },
        "seed": {
          "type": "integer",
          "description": "AI SDK CallSettings.seed: integer seed for deterministic sampling. Provider support varies."
        },
        "maxRetries": {
          "type": "integer",
          "minimum": 0,
          "description": "AI SDK CallSettings.maxRetries: maximum number of retries on transient API failures. 0 disables retries. AI SDK default: 2."
        },
        "headers": {
          "$ref": "#/$defs/headers"
        },
        "providerOptions": {
          "$ref": "#/$defs/providerOptions",
          "description": "AI SDK providerOptions: provider-specific JSON options passed through to the provider. Outer key = provider name (e.g. 'anthropic', 'openai', 'google')."
        },
        "timeoutMs": {
          "type": "integer",
          "minimum": 1,
          "description": "App-level timeout in milliseconds before aborting the request. Not an AI SDK CallSettings field. Default in this project: 480000 (8 minutes)."
        }
      }
    },
    "defaultRoute": {
      "allOf": [
        { "$ref": "#/$defs/taskRoute" },
        { "required": ["profile", "model"] }
      ],
      "description": "Default route must specify at least profile and model."
    },
    "providerOptions": {
      "type": "object",
      "description": "AI SDK providerOptions. Known provider keys are documented for editor assistance; unknown provider keys remain allowed for OpenAI-compatible endpoints and future AI SDK provider options.",
      "properties": {
        "anthropic": { "$ref": "#/$defs/anthropicProviderOptions" },
        "openai": { "$ref": "#/$defs/openaiProviderOptions" },
        "google": { "$ref": "#/$defs/googleProviderOptions" },
        "deepseek": { "$ref": "#/$defs/genericProviderOptions" },
        "mistral": { "$ref": "#/$defs/genericProviderOptions" },
        "xai": { "$ref": "#/$defs/genericProviderOptions" },
        "ollama": { "$ref": "#/$defs/genericProviderOptions" },
        "openai-compatible": { "$ref": "#/$defs/genericProviderOptions" }
      },
      "additionalProperties": { "$ref": "#/$defs/genericProviderOptions" }
    },
    "genericProviderOptions": {
      "type": "object",
      "additionalProperties": { "$ref": "#/$defs/jsonValue" }
    },
    "anthropicProviderOptions": {
      "type": "object",
      "description": "@ai-sdk/anthropic providerOptions.",
      "properties": {
        "thinking": {
          "type": "object",
          "description": "Anthropic extended thinking configuration.",
          "required": ["type"],
          "additionalProperties": false,
          "properties": {
            "type": {
              "enum": ["enabled", "disabled"]
            },
            "budgetTokens": {
              "type": "number",
              "minimum": 1
            }
          }
        }
      },
      "additionalProperties": { "$ref": "#/$defs/jsonValue" }
    },
    "openaiProviderOptions": {
      "type": "object",
      "description": "@ai-sdk/openai Responses API providerOptions. Chat-model construction settings such as logitBias/structuredOutputs/reasoningEffort are not route-level settings in the current provider factory.",
      "properties": {
        "metadata": { "$ref": "#/$defs/jsonValue" },
        "parallelToolCalls": { "type": ["boolean", "null"] },
        "previousResponseId": { "type": ["string", "null"] },
        "store": { "type": ["boolean", "null"] },
        "user": { "type": ["string", "null"] },
        "reasoningEffort": { "type": ["string", "null"] },
        "strictSchemas": { "type": ["boolean", "null"] },
        "instructions": { "type": ["string", "null"] },
        "reasoningSummary": { "type": ["string", "null"] }
      },
      "additionalProperties": { "$ref": "#/$defs/jsonValue" }
    },
    "googleProviderOptions": {
      "type": "object",
      "description": "@ai-sdk/google providerOptions.",
      "properties": {
        "responseModalities": {
          "type": ["array", "null"],
          "items": { "enum": ["TEXT", "IMAGE"] }
        },
        "thinkingConfig": {
          "type": ["object", "null"],
          "additionalProperties": false,
          "properties": {
            "thinkingBudget": { "type": ["number", "null"] },
            "includeThoughts": { "type": ["boolean", "null"] }
          }
        }
      },
      "additionalProperties": { "$ref": "#/$defs/jsonValue" }
    },
    "baseProviderProfile": {
      "type": "object",
      "additionalProperties": false,
      "required": ["provider"],
      "properties": {
        "provider": {
          "enum": ["anthropic", "openai", "google", "deepseek", "mistral", "xai"]
        },
        "apiKeyEnv": {
          "type": "string",
          "minLength": 1,
          "description": "Environment variable name that contains the API key. Runtime requires this for hosted providers."
        },
        "baseURL": {
          "type": "string",
          "format": "uri",
          "description": "Optional custom API base URL."
        }
      }
    },
    "anthropicProvider": {
      "allOf": [
        { "$ref": "#/$defs/baseProviderProfile" },
        {
          "properties": {
            "provider": { "const": "anthropic" }
          }
        }
      ]
    },
    "openaiProvider": {
      "allOf": [
        { "$ref": "#/$defs/baseProviderProfile" },
        {
          "properties": {
            "provider": { "const": "openai" }
          }
        }
      ]
    },
    "googleProvider": {
      "allOf": [
        { "$ref": "#/$defs/baseProviderProfile" },
        {
          "properties": {
            "provider": { "const": "google" }
          }
        }
      ]
    },
    "deepseekProvider": {
      "allOf": [
        { "$ref": "#/$defs/baseProviderProfile" },
        {
          "properties": {
            "provider": { "const": "deepseek" }
          }
        }
      ]
    },
    "mistralProvider": {
      "allOf": [
        { "$ref": "#/$defs/baseProviderProfile" },
        {
          "properties": {
            "provider": { "const": "mistral" }
          }
        }
      ]
    },
    "xaiProvider": {
      "allOf": [
        { "$ref": "#/$defs/baseProviderProfile" },
        {
          "properties": {
            "provider": { "const": "xai" }
          }
        }
      ]
    },
    "ollamaProvider": {
      "type": "object",
      "additionalProperties": false,
      "required": ["provider"],
      "properties": {
        "provider": { "const": "ollama" },
        "apiKeyEnv": { "type": "string", "minLength": 1 },
        "baseURL": {
          "type": "string",
          "description": "Ollama server URL. Runtime default: http://localhost:11434"
        }
      }
    },
    "openaiCompatibleProvider": {
      "type": "object",
      "additionalProperties": false,
      "required": ["provider", "name", "baseURL"],
      "properties": {
        "provider": { "const": "openai-compatible" },
        "name": {
          "type": "string",
          "minLength": 1,
          "description": "Human-readable name for this custom endpoint."
        },
        "apiKeyEnv": { "type": "string", "minLength": 1 },
        "baseURL": { "type": "string", "format": "uri" },
        "headers": {
          "$ref": "#/$defs/headers",
          "description": "Custom HTTP headers to send with requests for this provider profile."
        }
      }
    },
    "providerProfile": {
      "oneOf": [
        { "$ref": "#/$defs/anthropicProvider" },
        { "$ref": "#/$defs/openaiProvider" },
        { "$ref": "#/$defs/googleProvider" },
        { "$ref": "#/$defs/deepseekProvider" },
        { "$ref": "#/$defs/mistralProvider" },
        { "$ref": "#/$defs/xaiProvider" },
        { "$ref": "#/$defs/ollamaProvider" },
        { "$ref": "#/$defs/openaiCompatibleProvider" }
      ]
    }
  }
}
